"Pakistan is compelling Kulbhushan Jadhav to convey a version of events , the MEA said. India's official statement came after Pakistan allowed an Indian diplomat to meet Mr Jadhav according to verdict of the INternational Court of Justice (ICJ).",seems true
"Defence Minister Rajnath Singh, on a two-day visit to Japan, on Monday met Shinzo Abe in Tokyo and said India was committed to enhance defence engagements between the two countries, besides strengthening bilateral arrangements.",seems true
"In a nondescript building near Moffett Field, still undistracted by any VC funding, an 80-person company named Made In Space is building tools for the next generation of satellites and space explor...",seems true
3D printers on the final frontier: Made In Space is building satellites that build themselves Jon Evans,seems true
"Watch the Porsche Taycan make a 0-90-0 test run on the USS Hornet flight deck Porsche is squeezing in one more teaser ahead of the global debut of the all-electric Porsche Taycan. And this time, the German automaker didn’t hold back.",seems true
"A number of malicious websites used to hack into iPhones over a 2 year period were targeting Uyghur Muslims, TechCrunch has learned. Sources familiar with matter said the websites were part of a state backed attack designed to target the Uyghur community",seems true
"Google found and recently disclosed the malicious websites this week, but until now it wasn’t known who they were targeting. The websites were part of a campaign by infecting an iPhone with malicious code simply by visiting a booby-trapped web page.",seems true
"Made in Space s 3D printers have already done several tours of duty on the International Space Station, Five years ago, manufacturing in space was a dream, says Andrew Rush, co-founder and CEO. Now there are months we re manufacturing so much stuff in orbi",seems true
"Urban, the company that lets you book a growing range of “wellness” services on demand — spanning massage, osteopathy, to various beauty treatments — is adding physiotherapy to its roster in a bid to become a “one-stop-shop” for physical wellbeing.",seems true
"Bytedance shifts leadership again in pursuit of growth. Bytedance has been looking for strategies to reignite Jinri Toutiao’s stagnating user base growth. Zhu Wenjia, who was promoted in June to the head of Jinri Toutiao, will report directly to founder Zh",seems true
"Dai Zhikang, the billionaire founder and chairman of Shanghai-based investment and real estate development conglomerate Zendai Group, turned himself in to police on charges related to his company’s peer-to-peer (P2P) lending platform, which was shuttered i",seems true
"China’s top scholars are calling for more policies which encourage data sharing and product standards for autonomous vehicles, and advocating for higher levels of autonomy for testing the technology.",seems true
Delhi Police have registered a case under Arms Act & other sections against the 26-year-old man who tried to enter the Parliament allegedly with a knife. He has been arrested,seems true
"There was a time when people, especially those from North India, didn't like Gujarati food because they thought it is too sweet. They used to say you put sugar even in bitter gourd. Now everyone asks where do we get good Gujarati food.",seems true
"West Bengal: CM Mamata Banerjee has called for a meeting with Metro Railway officials tomorrow at the State Secretariat Nabanna, to access the situation in Bowbazar where cracks developed in houses during tunnel boring for the E-W (East-West) metro yesterday.",seems true
Prime Minister Of India after inauguration of Garvi Gujarat Bhawan in Delhi: I am seeing some of you after several years...Anyone could've cut the ribbon. But I am glad that I got this opportunity as I am able to meet you all.,seems true
Major rescue operation under way in California after fire on a boat with more than 30 people on board,seems true
Finger licking good? #KFC sells out of plant-based chicken in Atlanta in an experiment to measure appetite. could be rolled out nationally and then internationally if customer feedback is good. Are you trying to eat less meat? Flexitarian? ,seems true
"The Amazon rain forest — the lungs which produce 20% of our planet's oxygen — is on fire, tweeted French President Emanuel Macron",seems true
"Fires in the Amazon rainforest have captured attention worldwide in recent days. Brazilian President Jair Bolsonaro, who took office in 2019, pledged in his campaign to reduce environmental protection and increase agricultural development in the Amazon, an",seems true
"Brazil’s government is banning most legal fires, used for land-clearing, for at least 60 days. An official decree published Thursday prohibited the fires, typically set during the country’s dry season, Fox News reported.",seems true
"The Union Government took a firm decision and made Jammu and Kashmir an inseparable part of India in one go, Union Home Minister Amit Shah said on Thursday, historic decision to revoke the border state special status and bifurcate it",seems true
Pakistan Foreign Office said that Qureshi apprised the delegation of the illegal actions of India in Kashmir. Qureshi also said that UNSC's recent closed consultations on Jammu and Kashmir is testimony to the fact that this is an internationally recognised,seems true
"Culminating his 3 nation visit to France, Bahrain and UAE, Narendra Modi returned to New Delhi on Tuesday morning. PM Modi also took part in the recently-concluded G7 summit in France's Biarritz, in the sessions on digital transformation and climate change",seems true
"Donald Trump skips climate discussion at G7 Summit in France, claims to know more about the environment than anyone US president Donald Trump skipped a discussion on climate with other world leaders at the Group of Seven summit in France",seems true
"For many of the main subjects, CBSE now has a practical assessment and the main or theory paper. Often called internal and external assessment or CBSE Board Practical exams, these are important marks for students of both classes.",seems true
"Former Indian cricketer Yuvraj Singh has hailed Jasprit Bumrah as once-in-a-generation bowler and a cut above the rest at the moment in international cricket. He also said that the first time he spotted Bumrah was back in 2013 and back then, he had predict",seems true
The government has been battling economic slowdown with quaterly growth slowing to a six-year low of 5%. The auto industry is among the worst hit sectors with sales falling to an over two decade low prompting company to cut production and lay off workers.,seems true
"India and 10 member Assosciationof Soth East Asian Nations (ASEAN) have agreed to review their decade old free trade pact, they said on Tuesday, as India's deepening trade deficit prompts local industries to demand changes to trading arrangements.",seems true
"China E-comm Tycoon steps down. Jack ma, chairman of chinese e-commerce giant Alibaba calls it a day from his role on 55th birthday. He is also a member of the ruling communist party.",seems true
"The insolvency and bankruptcy proceedings against Jet Airways in India and the Netherlands bring to fore the lucanae in the Insolvency and Bankruptcy Code (IBC), 2016 to deal with cross border insolvencies.",seems true
Union Minister Prakash Javadekar addressed a press conference on key decisions taken by the Government in the first hundered days of its second term. The minister released the book Jan Connect and inaugrated exhibition on Futhering India s development - 100,seems true
Captain Shubman Gill missed  out on a century by 10 runs while Jalaj Saxena struck 61 not out as India A dominated gainst South Africa A in the second day of first unofficial test at Thiruvanthapuram on Tuesday.,seems true
